{
  "schema_version": 2,
  "resource_kind": "case",
  "resource_id": "ca4m4.case.benton-retaliation",
  "title": "Leora Benton v. Blue Cedar Compliance, Inc.",
  "procedure_profile_id": "ca4m4.benton.procedure.civil-appeal",
  "record_id": "ca4m4.benton.record",
  "actors": [
    {
      "actor_id": "ca4m4.benton.actor.leora-benton",
      "role_id": "us.ca4.role.initiating-party",
      "display_name": "Leora Benton (fictional)",
      "synthetic": true
    },
    {
      "actor_id": "ca4m4.benton.actor.blue-cedar",
      "role_id": "us.ca4.role.responding-party",
      "display_name": "Blue Cedar Compliance, Inc. (fictional)",
      "synthetic": true
    },
    {
      "actor_id": "ca4m4.benton.actor.ca4-clerk",
      "role_id": "us.ca4.role.court",
      "display_name": "Fictional Fourth Circuit exercise clerk",
      "synthetic": true
    },
    {
      "actor_id": "ca4m4.benton.actor.composite-panel",
      "role_id": "us.ca4.role.court",
      "display_name": "Fictional composite Fourth Circuit panel",
      "synthetic": true
    }
  ],
  "issues": [
    {
      "issue_id": "ca4m4.benton.issue.retaliation-summary-judgment",
      "title": "Whether the admitted record permits a reasonable factfinder to find protected activity, decisionmaker knowledge, pretext, and but-for causation",
      "authority_ids": [
        "ca4m4.benton.authority.title-vii-retaliation",
        "ca4m4.benton.authority.foster-framework",
        "ca4m4.benton.authority.foster-pretext",
        "ca4m4.benton.authority.frcp-56-summary-judgment"
      ],
      "record_anchor_ids": [
        "ca4m4.benton.anchor.ja3",
        "ca4m4.benton.anchor.ja4",
        "ca4m4.benton.anchor.ja5",
        "ca4m4.benton.anchor.ja6",
        "ca4m4.benton.anchor.ja7",
        "ca4m4.benton.anchor.ja42",
        "ca4m4.benton.anchor.ja43",
        "ca4m4.benton.anchor.ja44",
        "ca4m4.benton.anchor.ja47",
        "ca4m4.benton.anchor.ja58",
        "ca4m4.benton.anchor.ja64",
        "ca4m4.benton.anchor.ja65",
        "ca4m4.benton.anchor.ja68",
        "ca4m4.benton.anchor.ja70",
        "ca4m4.benton.anchor.ja71",
        "ca4m4.benton.anchor.ja72",
        "ca4m4.benton.anchor.ja82",
        "ca4m4.benton.anchor.ja88",
        "ca4m4.benton.anchor.ja89",
        "ca4m4.benton.anchor.ja91",
        "ca4m4.benton.anchor.ja93",
        "ca4m4.benton.anchor.ja96",
        "ca4m4.benton.anchor.ja98",
        "ca4m4.benton.anchor.ja103",
        "ca4m4.benton.anchor.ja110",
        "ca4m4.benton.anchor.ja111",
        "ca4m4.benton.anchor.ja112",
        "ca4m4.benton.anchor.ja113",
        "ca4m4.benton.anchor.ja118",
        "ca4m4.benton.anchor.ja120",
        "ca4m4.benton.anchor.ja121",
        "ca4m4.benton.anchor.ja122",
        "ca4m4.benton.anchor.ja124",
        "ca4m4.benton.anchor.ja125",
        "ca4m4.benton.anchor.ja126",
        "ca4m4.benton.anchor.ja132",
        "ca4m4.benton.anchor.ja136",
        "ca4m4.benton.anchor.ja140",
        "ca4m4.benton.anchor.ja146",
        "ca4m4.benton.anchor.ja156",
        "ca4m4.benton.anchor.ja166",
        "ca4m4.benton.anchor.ja188",
        "ca4m4.benton.anchor.ja189",
        "ca4m4.benton.anchor.ja190",
        "ca4m4.benton.anchor.ja191",
        "ca4m4.benton.anchor.ja192",
        "ca4m4.benton.anchor.ja193",
        "ca4m4.benton.anchor.ja217",
        "ca4m4.benton.anchor.ja218",
        "ca4m4.benton.anchor.ja219",
        "ca4m4.benton.anchor.ja220",
        "ca4m4.benton.anchor.ja221",
        "ca4m4.benton.anchor.ja222",
        "ca4m4.benton.anchor.ja236",
        "ca4m4.benton.anchor.ja237",
        "ca4m4.benton.anchor.ja238",
        "ca4m4.benton.anchor.ja239",
        "ca4m4.benton.anchor.ja240",
        "ca4m4.benton.anchor.ja241",
        "ca4m4.benton.anchor.ja242",
        "ca4m4.benton.anchor.ja243",
        "ca4m4.benton.anchor.ja244",
        "ca4m4.benton.anchor.ja245",
        "ca4m4.benton.anchor.ja246",
        "ca4m4.benton.anchor.ja247"
      ]
    },
    {
      "issue_id": "ca4m4.benton.issue.late-comparator-declaration-exclusion",
      "title": "Whether the district court abused its discretion by narrowly excluding the late Wynn declaration under Rules 26 and 37",
      "authority_ids": [
        "ca4m4.benton.authority.frcp-26e-supplementation",
        "ca4m4.benton.authority.frcp-37c1-nondisclosure",
        "ca4m4.benton.authority.benjamin-disclosure-sanction"
      ],
      "record_anchor_ids": [
        "ca4m4.benton.anchor.ja21",
        "ca4m4.benton.anchor.ja23",
        "ca4m4.benton.anchor.ja24",
        "ca4m4.benton.anchor.ja28",
        "ca4m4.benton.anchor.ja29",
        "ca4m4.benton.anchor.ja30",
        "ca4m4.benton.anchor.ja34",
        "ca4m4.benton.anchor.ja114",
        "ca4m4.benton.anchor.ja121",
        "ca4m4.benton.anchor.ja136",
        "ca4m4.benton.anchor.ja140",
        "ca4m4.benton.anchor.ja145",
        "ca4m4.benton.anchor.ja194",
        "ca4m4.benton.anchor.ja195",
        "ca4m4.benton.anchor.ja222",
        "ca4m4.benton.anchor.ja223",
        "ca4m4.benton.anchor.ja224",
        "ca4m4.benton.anchor.ja225",
        "ca4m4.benton.anchor.ja226",
        "ca4m4.benton.anchor.ja227",
        "ca4m4.benton.anchor.ja228",
        "ca4m4.benton.anchor.ja229",
        "ca4m4.benton.anchor.ja230",
        "ca4m4.benton.anchor.ja231",
        "ca4m4.benton.anchor.ja232",
        "ca4m4.benton.anchor.ja233",
        "ca4m4.benton.anchor.ja234",
        "ca4m4.benton.anchor.ja235",
        "ca4m4.benton.anchor.ja237"
      ]
    }
  ],
  "authored_disposition_id": "ca4m4.benton.operation.issue-judgment"
}
